Title,Category 1,Category 2,Category 3,Brand,Supplement Facts,Description,final_fail_reason
"Pure Planet, Organic Amla Plus, 500 mg, 100 Tablets",Pure Planet,Amla,Spirulina,Pure Planet,"Supplement FactsServing Size: 10 tablets (5000 mg)Servings Per Container: 10Amount Per Serving%Daily Value*Organic Amla Berry4000 mg†Organic Spirulina1000 mg†Vitamin C15 mg25%*The % Daily Value (DV) tells you how much a nutrient in a serving of food contributes to a daily diet. 2,000 calorie a day is used for general nutrition advice.†Daily value not established.","An Ancient Ayurvedic HerbWith Tannins & AntioxidantsGluten FreeDietary SupplementUSDA OrganicNon GMO Project VerifiedVeganAmla Plus is Certified Organic by QAIKosherAmla is the most revered herb in ancient Ayurvedic remedy. It is a naturally bitter, whole food source of true vitamin C and tannins. Pure Planet selects only the finest Amalaki fruit and delivers it in our proprietary blend for nutritional balance and effect.",성분 추출 실패
"Kyolic, Aged Garlic Extract, Red Yeast Rice Plus CoQ10, 75 Capsules",Kyolic,Garlic,Red Yeast Rice,Kyolic,Supplement FactsServing Size: 3 CapsulesServing Per Container: 25 Amount per serving%Daily ValueOrganic Red Yeast Rice (Monascus purpureus)1200 mg*Aged Garlic Extract™† Powder (bulb)300 mg*Coenzyme Q1060 mg**Daily Value not established†Special Garlic Preparation,"1,200 mg Organic Red Yeast RiceDietary SupplementGMP CertifiedKyolic® Red Yeast Rice plus CoQ10 uses only the highest quality, 100% organically grown, GMO-free, non-irradiated Red Yeast Rice, along with odorless Aged Garlic Extract™ made from organic raw garlic, plus CoQ10, for a synergistic combination to provide unique benefits. Red Yeast Rice has been safety and traditionally used in Asia for centuries.Take Kyolic Red Yeast Rice as part of a healthy and active lifestyle along with a healthy diet, exercise and proper rest.",성분 추출 실패
"FutureBiotics, Certified Organic Iron + C, 90 Organic Vegetarian Tablets",FutureBiotics,Iron,Vitamin C,FutureBiotics,Supplement FactsServing Size: 3 tabletsServings Per Container: 30Amount Per Serving%Daily ValueVitamin C (from Organic Amla Fruit Extract)120 mg133%Iron (from Organic Curry Leaves Extract)27 mg150%,"Health. Nature. Life.Iron 27 mgFrom Curry Leaves and Amla FruitDietary Supplement30 Day SupplyUSDA OrganicCertified Organic by: NOFA-NY Certified Organic, LLCDaily Bioactive Guarantee:Supports Red Blood Cell Production and Helps Combat Iron DeficiencyIron + C - The ""Whole"" Story - Active Iron + C from Whole FoodWhy Organic?Organic products are good for you and good for the environment. Certified organic whole foods, are responsibly harvested and provide more of the healthy benefits that nature intended!Daily Bioactive GuaranteeNatural iron (27 mg per daily serving) from certified organic curry leaves extract.Natural vitamin C (120 mg per daily serving) from certified organic amla fruit extract.All of the other supportive, naturally-occurring plants co-nutrients.Did you know?Taking iron with vitamin C enables the body to better absorb the iron.Certified Organic - Futurebiotics Iron + C is certified organic. In fact, every single ingredient in this product without exception, is certified organic.Iron + CIron - Supports Red Blood Cell Production and Helps Combat Iron DeficiencyWith whole-food Vitamin C for improved iron absorption100% natural source - Free of pesticides, fertilizer and preservatives.Iron + C is formulated to support the production of red blood cells and help reduce iron deficiency in the body.Plant-based iron is friendlier to the digestive system than other forms of iron. Often times iron can cause stomach upset or other unpleasant side effects. Futurebiotics utilizes natural iron extracted from curry leaves to provide effective, yet gentler iron supplementation. Furthermore, our organic curry leaves extract also provides naturally-occurring plant constituents to support the natural iron activity.Taking vitamin C and iron together helps the body to better absorb the iron. Futurebiotics includes natural vitamin C extracted from organic amla fruit. Our organic amla extract also provides other naturally-occurring co-nutrients from the fruit that help protect the stability and activity of the vitamin C.Our curry leaves and amla fruit are grown in carefully balanced soil on privately-owned organic farms without chemical pesticides or fertilizers.Iron + C from Curry Leaves and Amla Fruit - pure, fresh, and bioactive just like Nature intended. 100% Vegetarian. Glass packaging extends natural freshness and helps maintain potency.",성분 추출 실패
"Bluebonnet Nutrition, Alpha Lipoic Acid, 600 mg, 60 Vegetable Capsules",Bluebonnet Nutrition,Alpha Lipoic Acid,,Bluebonnet Nutrition,Supplement FactsServing Size: 1 CapsuleServing Per Container: 60Amount Per Serving:%Daily ValueAlpha Lipoic Acid (as thioctic acid)600 mg** Daily Value not established,Made with Non GMO IngredientsMay Support Free Radical ProtectionVeganGluten FreeKosher ParveDietary SupplementBluebonnet's Alpha Lipoic Acid 600 mg Vegetable Capsules are formulated with alpha lipoic acid in its crystalline form. Alpha lipoic acid is a unique fat- soluble and water soluble nutrient known for its free radical scavenger activity.,성분 추출 실패
"21st Century, Vitamin C, Prolonged Release, 500 mg, 110 Tablets",21st Century,Vitamin C,Common Cold & Flu,21st Century,Supplement FactsServing Size: 1 Tablet Amount Per Serving:%Daily ValueVitamin C (as Ascorbic Acid)500 mg556%Calcium (as Calcium Carbonate)40 mg4%,Antioxidant & Immune SupportVitamin SupplementGluten FreeGuaranteed Quality Laboratory TestedVitamin C is an important antioxidant nutrient that supports the immune system. Prolonged release vitamins slowly release nutrients into the body over an extended period of time.,성분 추출 실패
"Solaray, Schizandra, 580 mg, 100 VegCaps",Solaray,Schisandra (Schizandra),,Solaray,Supplement FactsServing Size: 1 VegCapAmount Per Serving%Daily Value Schizandra (Schisandra chinensis) (berry)580 mg**Daily Value not established.,"Est. 1973True Herbs+Herbal SupportDietary SupplementLab VerifiedVeganA Brighter Way100% PCR BottlesSince 1973, we've scoured the globe for the highest quality ingredients, connecting you with the most efficacious supplements that help you live brighter & embrace the moments that matter most.Discussion: Schizandra's bright red berries have a long history of use in Traditional Chinese Medicine, where it is referred to as the five-flavored seed"" because it tastes sour, bitter, sweet, acrid and salty. Schisandra is known as an adaptogen, a unique class of herbs that support the body's ability to adapt to stress.",성분 추출 실패
"Herbs Etc., ChlorOxygen, Chlorophyll Concentrate, 60 Fast-Acting Softgels",Herbs Etc.,Chlorophyll,Oxygen Supplements,Herbs Etc.,Supplement FactsServing Size: 1 SoftgelServings Per Container: 60 Amount Per Serving% Daily ValueCalories5 Sodium4 mg<1%Copper2 mg100%Chlorophyll(Sodium Copper Chlorophyllinsfrom European Fescue leaf blade)50 mg††Daily Value not established,"Herbal MedicineLiquid in a Fast-Acting SoftgelProfessional StrengthBuilds Red Blood CellsIncreases Oxygenation#1 Seller Spins DataHerbal SupplementGluten-FreeChlorOxygen® chlorophyll concentrate increases the amount of oxygen available to cells. It supports the production of red blood cells and its blood-oxygen carrying capacity. It boosts energy levels. ChlorOxygen® is helpful for individuals traveling to or living in high altitude locations. It also supports digestive and intestinal health and ensures a healthy liver.Formulated by Daniel Gagnon, Medical Herbalist.",성분 추출 실패
"Nature's Life, L-Lysine Powder, Unflavored, 200 g",Nature's Life,L-Lysine,Common Cold & Flu,Nature's Life,Supplement FactsServing Size: 1/4 TeaspoonServings Per Container: 460 Amount Per Serving% Daily ValueL-Lysine HCL (from Sugar Beet Molasses)435 mg**Daily Value not established.,"Sun Food Energy100% L-Lysine HCL Dietary Supplement1/4 Tsp. DailyQuality You Can Trust™ Vegetarian ProductDiscussion: The essential amino acid lysine has many functions including supporting efficient utilization of low-lysine protein foods. Additionally, Lysine is intended to provide nutritive support for healthy immune system function.",성분 추출 실패
"Julian Bakery, InstaKetones Potassium, 0.91 lbs (414 g)",Julian Bakery,Potassium,,Julian Bakery,"Supplement FactsServing Size: 1 Scoop (13.8 g)Servings Per Container: 30 Amount Per Serving%Daily Value*Calories30 Total Fat0 g0%Cholesterol0 g0%Potassium3800 mg80%Total Carbohydrate0 g0%Protein0 g0%Beta Hydroxybutyrate(Potassium Ketone Salts)10 g†*The % Daily Value (DV) tells you how much a nutrient in a serving of food contributes to a daily diet. 2,000 calories a day is used for general nutrition advice.†Daily Value not established.","PaleoNo Sodium KetonesKeto FriendlyNo Animal ByproductsNo Artificial Colors or FlavoringsNo PreservativesApproved for IKDiet® - Phase 1 & Phase 2Gluten FreeVeganDairy FreeGMO-FreePotassium 19 K 39.098Dietary Supplement30 ServingsPer Serving:10 g of BHB30 Calories3.8 g Potassium0 g Fat InstaKetones® is a true game changer in helping you reach and maintain your ideal weight. InstaKetones Potassium contains no Sodium Ketones! It can dramatically increase endurance and promote a leaner more sculpted look in conjunction with the IKDiet® and exercise plan. It can boost measurable blood ketones by up to 2.0 mmo/L within 40 minutes.Ketones are a super fuel used by the muscles and the brain, where they generate more energy (ATP) per unit of oxygen consumed than do carbohydrates, protein, or fat. InstaKetones Potassium has 10 grams of the ketone body Beta-Hydroxybutyrate (BHB) per serving and no artificial sweeteners, flavorings or colors. Consumption of InstaKetones before exercise can result in significant decreases in oxygen demand and increases in performance - and may also heighten mental acuity and performance.InstaKetones Potassium is excellent for ketogenic dieters who need energy but must limit carbohydrate intake. InstaKetones may also be used by individuals who consume carbohydrates to provide an additional energy source and limit exercise induced glycogen depletion.",성분 추출 실패
"21st Century, Vitamin C with Rose Hips, 500 mg, 110 Tablets",21st Century,Vitamin C,Common Cold & Flu,21st Century,Supplement FactsServing Size: 1 Tablet Amount Per Serving% Daily ValueVitamin C (as Ascorbic Acid)500 mg556%Rose Hips37 mg****Daily Value not established.,Antioxidant & Immune SupportVitamin SupplementGluten FreeGuaranteed Quality Laboratory TestedVitamin C is an important antioxidant nutrient that supports the immune system. With natural Rose Hips.,성분 추출 실패
"NOW Foods, CoQ10 With Hawthorn Berry, 100 mg, 180 Veg Capsules",NOW Foods,Coenzyme Q10 (CoQ10),,NOW Foods,Supplement FactsServing Size: 1 Veg Capsule Amount Per Serving%Daily ValueCoenzyme Q10 (CoQ10)100 mg**Hawthorn Berry (Crataegus laevigata and/or monogyna) (Fruit)400 mg****Daily Value not established.,"Cardiovascular HealthCellular Energy ProductionNon GMO Project VerifiedA Dietary SupplementVegetarian/VeganKosherGeneral HealthFamily Owned Since 1968GMP Quality AssuredCoenzyme Q10 (CoQ10) is a vitamin-like compound that plays a central role in cellular energy production. CoQ10 is found throughout the body, but is especially concentrated in the heart, liver, and kidney and production has been found to decline with age. CoQ10 works as a potent free radical scavenger in cell membranes, as well as within blood vessels. Years of scientific research have shown that CoQ10 helps to maintain a healthy heart and vascular system.NOW® CoQ10 is Pharmaceutical Grade. Now CoQ10 products contain only the all-trans form of CoQ10 produced by fermentation.",성분 추출 실패
"21st Century, 600+D3, Calcium & Vitamin D3 Supplement, 400 Tablets",21st Century,Calcium Plus Vitamin D,,21st Century,Supplement FactsServing Size: 1 Tablet Amount Per Serving% Daily ValueVitamin D3 (as Cholecalciferol)20 mcg (800 IU)100%Calcium (as Calcium Carbonate)600 mg46%,Gluten FreeBone Health SupportCompare  VS. Caltrate® 600+D3Guaranteed Quality Laboratory TestedCalcium is an important mineral for bone health. Vitamin D3 is added to assist with calcium absorption.,성분 추출 실패
"Solgar, Vegan CoQ-10, 200 mg, 60 Vegetable Capsules",Solgar,Coenzyme Q10 (CoQ10),,Solgar,Supplement FactsServing Size: 1 Vegetable CapsuleAmount Per Serving%Daily ValueCoenzyme Q-10 (as ubiquinone)200 mg****Daily Value not established,"Since 1947Heart HealthyProtective AntioxidantNon GMOCertified Gluten FreeWheat & Dairy FreeSuitable for VegansKosher ParveDietary SupplementKaneka Q10CoQ-10 is a fat-soluble antioxidant. Antioxidants help fight cell-damaging free radicals in the body. CoQ-10 is a clinically studied ingredient to promote heart, brain and neurological function. This formation is offered in a convenient two-piece capsule, suitable for vegans.",성분 추출 실패
"Barlean's, Brevail Plant Lignan Extract, 30 Capsules",Barlean's,Women's Hormone Support,Women's Health,Barlean's,Supplement FactsServing Size: 1 CapsuleServing Per Container: 30Amount Per Serving%Daily ValueVitamin D3 (as cholecalciferol)10 mcg (400 IU)50%Brevail® from flaxseed extract250 mg*Secoisolariciresinol Diglycoside50 mg**Daily Value (DV) not established.,"Dietary SupplementNon-GMOFor the support of:PMS, Mood & MenopauseHealthy Breast TissueHealthy Estrogen BalanceProactive Breast Health, PMS and Menopause SupportBrevail® is for all women interested in maintaining optimal breast health and/or, nutritional support for common PMS and menopausal discomforts - all naturally, with just one capsule per day.Breast & Hormonal Health as Nature IntendedBrevail® supplies lignans, natural compounds, ingested in seeds, grains, beans, fruits, and vegetables throughout human history.Research suggests that our bodies use natural plant lignans, now sparse in the modern diet, to safely and gently buffer and balance excess estrogens.Brevail® was university researched and developed to increase lignan concentrations in the body to match levels found in women who collectively demonstrate an extraordinary history of breast health and hormonal balance.Brevail® is one-of-a-kind natural plant extract supported by university research for safety and efficacy in women. ",성분 추출 실패
"NaturesPlus, Omega Krill Oil, 600 mg, 60 Liquid-Filled Capsules",NaturesPlus,Krill Oil,,NaturesPlus,Supplement FactsServing Size: 1 Liquid-Filled Capsule,"Gluten FreeDietary SupplementNutritional Support For:Healthy Heart FunctionHealthy Brain FunctionHealthy Inflammation ControlFree Radical DefenseAnti-Aging ProcessesOverall Well-BeingDiscover the amazing benefits of NaturesPlus® Omega Krill™ Oil, the most effective Krill Omega-3 EFA phospholipids ever developed, with 30% to 100% better EFA absorption than fish oils. NaturesPlus encapsulates only the world's purest Krill, sustainably harvested from pristine Antarctic waters. Pure Assure™ potency preservation technology, including complete nitrogen flush, rosemary extract and high-density, fish-gelatin capsules, guarantees maximum bioavailability. NaturesPlus Omega Krill Oil Liquid-Filled Capsules deliver benefits you can feel!",성분 추출 실패
"NOW Foods, SAMe (Disulfate Tosylate), 400 mg, 60 Enteric Coated Tablets",NOW Foods,"SAM-e, Tosylate",,NOW Foods,Supplement FactsServing Size: 1 Tablet Amount Per Serving%Daily ValueSAMe (S-Adenosyl-L-Methionine)(from S-Adenosyl-L-Methionine Disulfate Tosylate)400 mg** Daily Value not established.,"Nervous System SupportSupports Emotional Well-BeingSupports Joint HealthEnteric CoatedNew Oval TabletEnteric CoatedA Dietary SupplementVegetarian/VeganKosherAmino AcidsFamily Owned Since 1968GMP Quality AssuredSAMe (S-adenosylmethionine), a compound native to the body, is a component of many biochemical reactions, including those that affect brain biochemistry and joint health. Numerous studies have indicated that SAMe can help to alleviate transient minor aches and pains resulting from overexertion or strain. In addition, because SAMe is also necessary for the synthesis of neurotransmitters, it plays an important role in mood support. NOW® SAMe is enteric-coated, which makes it very well tolerated and protects it from degradation.",성분 추출 실패
"NaturesPlus, Source of Life Garden, Iron, 30 Vegan Capsules",NaturesPlus,Iron,,NaturesPlus,Supplement FactsServing Size:  1 CapsuleServings Per Container: 30 Amount Per Serving%Daily ValueIron (from Certified Organic Curry [Murraya koenigii] extract)♦18 mg100%♦Orgen Brand,"Certified Non-GMOWhole Food GrownGluten Free USDA OrganicDietary SupplementCertified Organic by EcoCert ICONutritional Support for Healthy Blood.NaturesPlus® Source of Life® Garden Iron Caps promote circulatory and cardiovascular health, utilizing the dramatic power of certified organic iron, naturally concentrated from curry.For those seeking an organic, naturally available, plant-based iron source, you can now experience the dramatic difference with NaturesPlus Source of Life Garden Iron Caps.Formulated in a base of more than 20 organic whole fruits, vegetables, mushrooms, algae and herbs for synergized assimilation and maximum results.Made from 20 Organic Whole FoodsUSDA Organic USDA NOP Organic Certification guarantees the pure and wholesome status of this formula, made without synthetic/chemical pesticides and artificial fertilizersCertified Non-GMOTested and independently certified to be free from genetically modified materials and materials associated with GM organismsEnvironmentally ResponsibleGuaranteed to be manufactured using the most ecologically friendly environmentally responsible methods availableRecyclable Organic wholesome ingredients and recyclable packaging material ensure sustainability throughout the product's life cycleVeganMade without animal-derived ingredientsGluten FreeMade without wheat, barley, or any gluten contributors, and independently assayed and verified to meet all gluten-free standardsYeast FreeDesigned and produced without any yeast or yeast byproducts and therefore free from the many potential side effects of yeastIndependently GMP CertifiedManufacturing facility independently certified to meet stricter Good Manufacturing Practices (GMPs) than U.S. law requiresFALCPA Allergen FreeGuaranteed to be free from all of the major allergens identified in the U.S. Food Allergen Labeling and Consumer Protection Act",성분 추출 실패
"Sports Research, Elderberry Sambucus Complex Liquid Spray, 1,040 mg, 2 fl oz (60 ml)",Sports Research,Elderberry Sambucus,Sports Supplements,Sports Research,"Supplement FactsServing Size: 10 sprays (1.5 ml)Servings Per Container: 40 Amount Per Serving% Daily ValueProprietary Herbal Blend Extracts of Black Elderberry (Sambucus nigra), Slippery Elm Bark (Ulmus rubra), Echinacea purpurea (tops), Astragalus Root (A. membranaceus), Sage Leaf (Salvia officinalis), Propolis Resin (Resina propoli)192 mg ††Daily Value (DV) not established.","1040 mg of Black Elderberries Per Serving♦Slippery Elm Bark + EchinaceaDietary SupplementAlcohol & Preservative FreeQuality MattersIgen - Non-GMO TestedVegetarian FriendlyGluten FreeGet your seasonal wellness boost wherever you are! SR® Elderberry Spray provides the benefits of elderberries in a delicious on-the-go spray that you'll want to keep in your back pocket. Each serving provides the equivalent of 1040mg of fresh black elderberries** plus extracts of slippery elm bark, echinacea, and so much more.♦ Each 1.5 ml serving contains the equivalent of 1040 mg of fresh black elderberries.",성분 추출 실패
"NOW Foods, Prenatal Gels + DHA, 90 Softgels",NOW Foods,Prenatal Multivitamins,Pre & Post-Natal Formulas,NOW Foods,"Supplement FactsServing Size: 3 SoftgelsServings Per Container: 30 Amount Per Serving%Daily Value*Calories15 Calories from Fat15 Total Fat1.5 g†Vitamin A (100% as Beta-Carotene)5,000 IU63%Vitamin C (from Calcium Ascorbate)100 mg167%Vitamin D-3 (as Cholecalciferol)400 IU100%Vitamin E (as d-alpha Tocopheryl Acetate)100 IU333%Vitamin K (as Menaquinone K2 and Phytonadione K1)35 mcg†Thiamin (Vitamin B-1) (from Thiamin HCl)5 mg294%Riboflavin (Vitamin B-2)5 mg250%Niacin (Vitamin B-3) (as Niacinamide)12 mg60%Vitamin B-6 (from Pyridoxine HCl)9 mg360%Folate (as Folic Acid)800 mcg100%Vitamin B-12 (as Methylcobalamin)500 mcg6250%Biotin300 mcg100%Pantothenic Acid (Vitamin B-5) (from Calcium Pantothenate)20 mg200%Calcium [from Calcium Carbonate (Aquamin® Seaweed Derived Minerals), Calcium Citrate and Calcium Ascorbate]400 mg31%Iron (from Ferrochel Iron Bisglycinate) (TRAACS)27 mg150%Iodine (from Potassium Iodide)150 mcg100%Magnesium (from Magnesium Oxide, Aquamin® Seaweed Derived Minerals and Magnesium Citrate)200 mg44%Zinc (from Zinc Bisglycinate) (TRAACS®)15 mg100%Selenium (from Selenium Glycinate Complex) (Albion®)70 mcg†Copper (from Copper Bisglycinate) (TRAACS®)2 mg100%Manganese (from Manganese Bisglycinate) (TRAACS®)2 mg†Chromium (from Chromium Chelavite) (TRAACS®)120 mcg†Molybdenum (from Molybdenum Bisglycinate) (TRAACS®)75 mcg†Potassium (from Potassium Chloride)25 mg†Fish Oil Concentrate650 mg†DHA (Docosahexaenoic Acid)250 mg†EPA (Eicosapentaenoic Acid)90 mg†Borage Oil (Seed)125 mg†GLA (Gamma Linolenic Acid)25 mg†Choline (from Choline Bitartrate)10 mg†Inositol10 mg†Lutein (from Marigold Flowers)500 mcg†Lycopene (from Natural Tomato Extract)350 mcg†* Percent Daily Values for Pregnant and Lactating Women.† Daily Value not established.",Multi Vitamin & MineralWith 250 mg DHA per Serving to Support Healthy Eye and Brain DevelopmentPlus Borage Oil (GLA)A Dietary SupplementKosher - Contains GelatinFamily Owned Since 1968GMP Quality Assured,성분 추출 실패
"Flora, Swedish Bitters, 8.5 fl oz (250 ml)",Flora,Herbal & Swedish Bitters,Digestive Bitters,Flora,"Supplement FactsServing Size: 1 tsp. (5 ml)Servings Per Container: 50 Amount Per Serving %Daily ValueProprietary BlendAqueous extracts of angelica root, zedoary root, cape aloe leaf, manna sap, rhubarb (rheum palmatum) root, senna leaf, myrrh resin, carline thistle root, camphor wood, valerian root, cinnamon bark, cardamom seed, saffron flower.409 mg††Daily Value not established.","Premium Herbal FormulasMaria's Original FormulaAqueous ExtractAlcohol FreeDietary SupplementNon GMO Project VerifiedMaria's formula of Swedish Bitters represents the essence of skill, knowledge, and experience in producing the finest herbal bitters available. Flora has carefully selected and tested the herbs to achieve the highest quality and potency. Take before meals to stimulate the stomach to improve digestion or after meals to relieve feelings of fullness or gas.",성분 추출 실패
"Thorne Research, L-Glutamine Powder, 18.1 oz (513 g)",Thorne Research,L-Glutamine,,Thorne Research,Supplement FactsServing Size: One Scoop (5.7 g)Servings Per Container: 90 One Scoop (5.7 g) Contains:%DVL-Glutamine5 g**Daily Value (DV) not established.,"Dietary SupplementGI SupportFoundationalNSF - Certified SportGluten FreeL-glutamine is an amino acid that supports a healthy intestinal lining and immune function, and assists in healing after injury or surgery and in muscle cell repair. Thorne's L-Glutamine Powder is NSF Certified for Sport®. Evidence suggests supplemental L-glutamine benefits gastrointestinal health, supports wound healing, maintains immune health, and helps restore plasma glutamine levels depleted after periods of physical stress, such as prolonged exhaustive exercise. L-glutamine is the most prevalent amino acid in the bloodstream. It is found in high concentration in the gastrointestinal tract, which is its greatest user. Various stress factors – such as trauma, infection, malnutrition, chemotherapy, injury, and high-level athletic training – can adversely affect absorption in the small intestine, leading to food allergies. In numerous animal studies, the addition of L-glutamine improved absorption, as well as the gut's immune function.Skeletal muscles contain the greatest intracellular concentration of L-glutamine. But that concentration can be adversely affected by various insults, including injury, infection, chronic stress, malnutrition, and glucocorticoid use. Intense exercise lowers blood levels of glutamine, which can remain low if intense training is repeated without adequate recovery. Research indicates L-glutamine supplementation can offset these conditions.Because an athlete needs to know that his or her supplements are trustworthy and compliant, every batch of an NSF Certified for Sport® product is tested for compliance with label claims and to ensure the absence of more than 200 substances banned by many major athletic organizations, including stimulants, narcotics, steroids, diuretics, beta-2 agonists, and masking agents.",성분 추출 실패
"BPI Sports, Zinc, 50 mg, 120 Tablets",BPI Sports,Zinc,,BPI Sports,"Supplement FactsServing Size: 1 TabletServings Per Container: 120 Amount Per Serving%Daily ValueZinc (as Zinc Gluconate, Zinc Citrate)50 mg455% ",Immune Health Support† Dietary SupplementQuality TestedcGMP - Quality Verified - Good Manufacturing Practices† When combined with a proper exercise and nutrition regimen.,성분 추출 실패
